{
  "$schema": "https://json-schema.org/draft/2020-12/schema",
  "$id": "urn:world-studio:proposal:world_studio.robot_profile.v0.1",
  "title": "World Studio Robot Profile v0.1",
  "description": "Design proposal only. Describes robot geometry, kinematic limits, sensors, actuators, and interfaces for task-scoped validation. It is not a safety certificate or deployment authorization.",
  "type": "object",
  "additionalProperties": false,
  "required": [
    "schema",
    "robot_id",
    "version",
    "created_at",
    "lifecycle_status",
    "embodiment",
    "units",
    "base_frame",
    "geometry",
    "assets",
    "physical_asset_profile",
    "kinematics",
    "sensors",
    "actuators",
    "interfaces",
    "world_requirements",
    "authority",
    "provenance"
  ],
  "properties": {
    "schema": {
      "const": "world_studio.robot_profile.v0.1"
    },
    "robot_id": {
      "$ref": "#/$defs/identifier"
    },
    "version": {
      "type": "integer",
      "minimum": 1,
      "maximum": 2147483647
    },
    "created_at": {
      "$ref": "#/$defs/timestamp"
    },
    "lifecycle_status": {
      "enum": [
        "draft",
        "proposal",
        "validated",
        "promoted",
        "held",
        "rejected"
      ]
    },
    "embodiment": {
      "enum": [
        "differential_drive",
        "ackermann_vehicle",
        "omnidirectional_base",
        "legged_robot",
        "indoor_uav",
        "outdoor_uav",
        "mobile_manipulator",
        "fixed_manipulator",
        "custom"
      ]
    },
    "units": {
      "type": "object",
      "additionalProperties": false,
      "required": [
        "length",
        "mass",
        "time",
        "angle",
        "force",
        "torque"
      ],
      "properties": {
        "length": {
          "const": "m"
        },
        "mass": {
          "const": "kg"
        },
        "time": {
          "const": "s"
        },
        "angle": {
          "const": "rad"
        },
        "force": {
          "const": "N"
        },
        "torque": {
          "const": "N*m"
        }
      }
    },
    "base_frame": {
      "$ref": "#/$defs/identifier"
    },
    "geometry": {
      "type": "object",
      "additionalProperties": false,
      "required": [
        "footprint_xy_m",
        "height_m",
        "safety_margin_m",
        "geometry_status"
      ],
      "properties": {
        "footprint_xy_m": {
          "type": "array",
          "minItems": 3,
          "maxItems": 4096,
          "items": {
            "type": "array",
            "minItems": 2,
            "maxItems": 2,
            "items": {
              "$ref": "#/$defs/finiteNumber"
            }
          }
        },
        "height_m": {
          "$ref": "#/$defs/positiveFinite"
        },
        "safety_margin_m": {
          "$ref": "#/$defs/nonNegativeFinite"
        },
        "geometry_status": {
          "enum": [
            "proposal",
            "measured",
            "validated",
            "held"
          ]
        }
      }
    },
    "assets": {
      "type": "object",
      "additionalProperties": false,
      "required": [
        "visual",
        "collision",
        "description"
      ],
      "properties": {
        "visual": {
          "oneOf": [
            {
              "type": "null"
            },
            {
              "$ref": "#/$defs/artifactReference"
            }
          ]
        },
        "collision": {
          "oneOf": [
            {
              "type": "null"
            },
            {
              "$ref": "#/$defs/artifactReference"
            }
          ]
        },
        "description": {
          "$ref": "#/$defs/artifactReference"
        }
      }
    },
    "physical_asset_profile": {
      "oneOf": [
        {
          "type": "null"
        },
        {
          "$ref": "#/$defs/artifactReference"
        }
      ]
    },
    "kinematics": {
      "type": "object",
      "additionalProperties": false,
      "required": [
        "model",
        "limits",
        "joints"
      ],
      "properties": {
        "model": {
          "enum": [
            "differential_drive",
            "ackermann",
            "holonomic",
            "floating_base",
            "joint_chain",
            "custom"
          ]
        },
        "limits": {
          "type": "object",
          "additionalProperties": false,
          "required": [
            "linear_velocity_m_s",
            "linear_acceleration_m_s2",
            "angular_velocity_rad_s",
            "angular_acceleration_rad_s2",
            "minimum_turning_radius_m",
            "maximum_slope_rad"
          ],
          "properties": {
            "linear_velocity_m_s": {
              "$ref": "#/$defs/nonNegativeFinite"
            },
            "linear_acceleration_m_s2": {
              "$ref": "#/$defs/nonNegativeFinite"
            },
            "angular_velocity_rad_s": {
              "$ref": "#/$defs/nonNegativeFinite"
            },
            "angular_acceleration_rad_s2": {
              "$ref": "#/$defs/nonNegativeFinite"
            },
            "minimum_turning_radius_m": {
              "$ref": "#/$defs/nonNegativeFinite"
            },
            "maximum_slope_rad": {
              "type": "number",
              "minimum": 0,
              "maximum": 3.141592653589793
            }
          }
        },
        "joints": {
          "type": "array",
          "maxItems": 4096,
          "items": {
            "type": "object",
            "additionalProperties": false,
            "required": [
              "joint_id",
              "joint_type",
              "parent_frame",
              "child_frame",
              "axis",
              "lower_limit_rad",
              "upper_limit_rad",
              "limit_status"
            ],
            "properties": {
              "joint_id": {
                "$ref": "#/$defs/identifier"
              },
              "joint_type": {
                "enum": [
                  "fixed",
                  "revolute",
                  "continuous",
                  "prismatic"
                ]
              },
              "parent_frame": {
                "$ref": "#/$defs/identifier"
              },
              "child_frame": {
                "$ref": "#/$defs/identifier"
              },
              "axis": {
                "$ref": "#/$defs/vector3"
              },
              "lower_limit_rad": {
                "oneOf": [
                  {
                    "type": "null"
                  },
                  {
                    "$ref": "#/$defs/finiteNumber"
                  }
                ]
              },
              "upper_limit_rad": {
                "oneOf": [
                  {
                    "type": "null"
                  },
                  {
                    "$ref": "#/$defs/finiteNumber"
                  }
                ]
              },
              "limit_status": {
                "enum": [
                  "declared",
                  "measured",
                  "validated",
                  "held"
                ]
              }
            }
          }
        }
      }
    },
    "sensors": {
      "type": "array",
      "maxItems": 4096,
      "items": {
        "type": "object",
        "additionalProperties": false,
        "required": [
          "sensor_id",
          "kind",
          "frame_id",
          "rate_hz",
          "clock_domain",
          "calibration_status",
          "calibration"
        ],
        "properties": {
          "sensor_id": {
            "$ref": "#/$defs/identifier"
          },
          "kind": {
            "enum": [
              "rgb",
              "depth",
              "lidar",
              "imu",
              "odometry",
              "gnss",
              "force",
              "torque",
              "force_torque",
              "contact",
              "custom"
            ]
          },
          "frame_id": {
            "$ref": "#/$defs/identifier"
          },
          "rate_hz": {
            "type": "number",
            "exclusiveMinimum": 0,
            "maximum": 1000000000
          },
          "clock_domain": {
            "$ref": "#/$defs/identifier"
          },
          "calibration_status": {
            "enum": [
              "unverified",
              "current",
              "expired",
              "held"
            ]
          },
          "calibration": {
            "oneOf": [
              {
                "type": "null"
              },
              {
                "$ref": "#/$defs/artifactReference"
              }
            ]
          }
        }
      }
    },
    "actuators": {
      "type": "array",
      "maxItems": 4096,
      "items": {
        "type": "object",
        "additionalProperties": false,
        "required": [
          "actuator_id",
          "kind",
          "command_unit",
          "minimum_command",
          "maximum_command",
          "calibration_status"
        ],
        "properties": {
          "actuator_id": {
            "$ref": "#/$defs/identifier"
          },
          "kind": {
            "enum": [
              "wheel_velocity",
              "steering_angle",
              "joint_position",
              "joint_velocity",
              "joint_torque",
              "rotor_thrust",
              "custom"
            ]
          },
          "command_unit": {
            "enum": [
              "m/s",
              "rad",
              "rad/s",
              "N",
              "N*m",
              "dimensionless"
            ]
          },
          "minimum_command": {
            "$ref": "#/$defs/finiteNumber"
          },
          "maximum_command": {
            "$ref": "#/$defs/finiteNumber"
          },
          "calibration_status": {
            "enum": [
              "unverified",
              "current",
              "expired",
              "held"
            ]
          }
        }
      }
    },
    "interfaces": {
      "type": "array",
      "maxItems": 4096,
      "items": {
        "type": "object",
        "additionalProperties": false,
        "required": [
          "interface_id",
          "transport",
          "endpoint",
          "message_type",
          "direction"
        ],
        "properties": {
          "interface_id": {
            "$ref": "#/$defs/identifier"
          },
          "transport": {
            "enum": [
              "ros2_topic",
              "ros2_action",
              "ros2_service",
              "simulator_api",
              "custom"
            ]
          },
          "endpoint": {
            "type": "string",
            "minLength": 1,
            "maxLength": 512
          },
          "message_type": {
            "type": "string",
            "minLength": 1,
            "maxLength": 512
          },
          "direction": {
            "enum": [
              "input",
              "output",
              "bidirectional"
            ]
          }
        }
      }
    },
    "world_requirements": {
      "type": "object",
      "additionalProperties": false,
      "required": [
        "required_readiness",
        "required_authorities",
        "maximum_step_height_m",
        "minimum_clearance_m"
      ],
      "properties": {
        "required_readiness": {
          "type": "array",
          "minItems": 1,
          "maxItems": 16,
          "uniqueItems": true,
          "items": {
            "enum": [
              "visual",
              "metric",
              "collision",
              "semantic",
              "navigation",
              "physics"
            ]
          }
        },
        "required_authorities": {
          "type": "array",
          "minItems": 1,
          "maxItems": 16,
          "uniqueItems": true,
          "items": {
            "$ref": "#/$defs/identifier"
          }
        },
        "maximum_step_height_m": {
          "$ref": "#/$defs/nonNegativeFinite"
        },
        "minimum_clearance_m": {
          "$ref": "#/$defs/nonNegativeFinite"
        }
      }
    },
    "authority": {
      "$ref": "#/$defs/authority"
    },
    "provenance": {
      "$ref": "#/$defs/provenance"
    }
  },
  "$defs": {
    "identifier": {
      "type": "string",
      "pattern": "^[A-Za-z0-9][A-Za-z0-9._-]{0,127}$"
    },
    "timestamp": {
      "type": "string",
      "pattern": "^\\d{4}-\\d{2}-\\d{2}T\\d{2}:\\d{2}:\\d{2}(?:\\.\\d+)?Z$"
    },
    "finiteNumber": {
      "type": "number",
      "minimum": -1000000000000,
      "maximum": 1000000000000
    },
    "nonNegativeFinite": {
      "type": "number",
      "minimum": 0,
      "maximum": 1000000000000
    },
    "positiveFinite": {
      "type": "number",
      "exclusiveMinimum": 0,
      "maximum": 1000000000000
    },
    "vector3": {
      "type": "array",
      "minItems": 3,
      "maxItems": 3,
      "items": {
        "$ref": "#/$defs/finiteNumber"
      }
    },
    "sha256": {
      "type": "string",
      "pattern": "^sha256:[0-9a-f]{64}$"
    },
    "safeRelativePath": {
      "type": "string",
      "minLength": 1,
      "maxLength": 1024,
      "pattern": "^[^\\u0000]+$",
      "not": {
        "anyOf": [
          {
            "pattern": "^/"
          },
          {
            "pattern": "\\\\"
          },
          {
            "pattern": "//|/$"
          },
          {
            "pattern": "^[A-Za-z][A-Za-z0-9+.-]*:"
          },
          {
            "pattern": "(^|/)\\.\\.?(/|$)"
          }
        ]
      }
    },
    "artifactReference": {
      "type": "object",
      "additionalProperties": false,
      "required": [
        "path",
        "sha256",
        "size_bytes",
        "media_type"
      ],
      "properties": {
        "path": {
          "$ref": "#/$defs/safeRelativePath"
        },
        "sha256": {
          "$ref": "#/$defs/sha256"
        },
        "size_bytes": {
          "type": "integer",
          "minimum": 0,
          "maximum": 9007199254740991
        },
        "media_type": {
          "type": "string",
          "pattern": "^[a-z0-9][a-z0-9!#$&^_.+-]*/[a-z0-9][a-z0-9!#$&^_.+-]*$"
        }
      }
    },
    "authority": {
      "type": "object",
      "additionalProperties": false,
      "required": [
        "classification",
        "approved_for",
        "not_approved_for",
        "limitations"
      ],
      "properties": {
        "classification": {
          "enum": [
            "robot_profile_proposal",
            "task_scoped_validated_profile",
            "external_validation_required"
          ]
        },
        "approved_for": {
          "type": "array",
          "maxItems": 128,
          "uniqueItems": true,
          "items": {
            "$ref": "#/$defs/identifier"
          }
        },
        "not_approved_for": {
          "type": "array",
          "minItems": 1,
          "maxItems": 128,
          "uniqueItems": true,
          "items": {
            "$ref": "#/$defs/identifier"
          }
        },
        "limitations": {
          "type": "array",
          "minItems": 1,
          "maxItems": 128,
          "items": {
            "type": "string",
            "minLength": 1,
            "maxLength": 1024
          }
        }
      }
    },
    "provenance": {
      "type": "object",
      "additionalProperties": false,
      "required": [
        "producer",
        "producer_version",
        "created_at",
        "source_sha256",
        "reviewer"
      ],
      "properties": {
        "producer": {
          "$ref": "#/$defs/identifier"
        },
        "producer_version": {
          "type": "string",
          "minLength": 1,
          "maxLength": 128
        },
        "created_at": {
          "$ref": "#/$defs/timestamp"
        },
        "source_sha256": {
          "$ref": "#/$defs/sha256"
        },
        "reviewer": {
          "$ref": "#/$defs/identifier"
        }
      }
    }
  }
}
